{
  "eval_set_id": "medicalplab-retrieval-multisource-dev-v2",
  "version": "2.0.0",
  "corpus_document_ids": [
    "DOC-WHO-CARD-0001",
    "DOC-PMC-CARD-0002"
  ],
  "description": "Real multi-source DEV evaluation for the current WHO + PMC hypertension corpus. Includes single-source, genuinely multi-source, authority-sensitive, multilingual, hard-negative, and unsupported cases. This is a development set, not a held-out final benchmark.",
  "cases": [
    {
      "query_id": "MSV2-001",
      "query": "After a confirmed hypertension diagnosis, how soon should antihypertensive drug treatment begin, and when should it be started without delay?",
      "language": "en",
      "query_type": "clinical_style",
      "difficulty": "medium",
      "expected_answerable": true,
      "target_concept": "WHO timing of pharmacological treatment initiation after diagnosis",
      "expected_parent_section_number": "3.1",
      "evidence_scope": "single_source",
      "target_document_ids": [
        "DOC-WHO-CARD-0001"
      ],
      "preferred_document_id": null,
      "relevant_blocks": [
        {
          "document_id": "DOC-WHO-CARD-0001",
          "block_index": 13,
          "relevance": 3,
          "rationale": "WHO implementation remarks specify treatment within four weeks and immediate initiation for very high BP or end-organ damage."
        }
      ],
      "notes": "WHO-only case focused on timing rather than the diagnostic threshold."
    },
    {
      "query_id": "MSV2-002",
      "query": "هل لازم نستنى التحاليل قبل ما نبدأ علاج الضغط، وإيه الفحوصات المقترحة؟",
      "language": "ar",
      "query_type": "cross_lingual",
      "difficulty": "medium",
      "expected_answerable": true,
      "target_concept": "WHO laboratory testing without delaying hypertension treatment",
      "expected_parent_section_number": "3.2",
      "evidence_scope": "single_source",
      "target_document_ids": [
        "DOC-WHO-CARD-0001"
      ],
      "preferred_document_id": null,
      "relevant_blocks": [
        {
          "document_id": "DOC-WHO-CARD-0001",
          "block_index": 17,
          "relevance": 3,
          "rationale": "Primary WHO recommendation says testing should be obtained only when it does not delay or impede treatment."
        },
        {
          "document_id": "DOC-WHO-CARD-0001",
          "block_index": 18,
          "relevance": 2,
          "rationale": "Implementation remarks list suggested tests and state treatment should not be delayed when testing is unavailable."
        }
      ],
      "notes": "Arabic-to-English retrieval; distinguishes the WHO no-delay principle from generic testing lists."
    },
    {
      "query_id": "MSV2-003",
      "query": "Should cardiovascular risk assessment be completed before starting antihypertensive medication, or can it be done after treatment begins?",
      "language": "en",
      "query_type": "paraphrase",
      "difficulty": "medium",
      "expected_answerable": true,
      "target_concept": "WHO timing of cardiovascular risk assessment relative to treatment",
      "expected_parent_section_number": "3.3",
      "evidence_scope": "single_source",
      "target_document_ids": [
        "DOC-WHO-CARD-0001"
      ],
      "preferred_document_id": null,
      "relevant_blocks": [
        {
          "document_id": "DOC-WHO-CARD-0001",
          "block_index": 22,
          "relevance": 3,
          "rationale": "WHO recommends CVD risk assessment at or after treatment initiation when feasible and without delaying treatment."
        },
        {
          "document_id": "DOC-WHO-CARD-0001",
          "block_index": 23,
          "relevance": 2,
          "rationale": "Implementation remarks clarify that most patients at or above 140/90 do not need risk assessment before treatment."
        }
      ],
      "notes": null
    },
    {
      "query_id": "MSV2-004",
      "query": "For a patient whose baseline BP is ≥20/10 mmHg فوق الـtarget، إمتى تكون combination therapy especially valuable?",
      "language": "mixed",
      "query_type": "acronym_heavy",
      "difficulty": "medium",
      "expected_answerable": true,
      "target_concept": "WHO implementation criterion for initial combination therapy",
      "expected_parent_section_number": "3.5",
      "evidence_scope": "single_source",
      "target_document_ids": [
        "DOC-WHO-CARD-0001"
      ],
      "preferred_document_id": null,
      "relevant_blocks": [
        {
          "document_id": "DOC-WHO-CARD-0001",
          "block_index": 33,
          "relevance": 3,
          "rationale": "WHO implementation remarks state combination therapy may be especially valuable when baseline BP is at least 20/10 mmHg above target."
        }
      ],
      "notes": "Mixed-language query with numeric clinical criterion."
    },
    {
      "query_id": "MSV2-005",
      "query": "Under what conditions does WHO say pharmacists or nurses can provide pharmacological treatment for hypertension?",
      "language": "en",
      "query_type": "direct_fact",
      "difficulty": "medium",
      "expected_answerable": true,
      "target_concept": "WHO conditions for hypertension treatment by nonphysician professionals",
      "expected_parent_section_number": "3.8",
      "evidence_scope": "single_source",
      "target_document_ids": [
        "DOC-WHO-CARD-0001"
      ],
      "preferred_document_id": null,
      "relevant_blocks": [
        {
          "document_id": "DOC-WHO-CARD-0001",
          "block_index": 44,
          "relevance": 3,
          "rationale": "Primary WHO recommendation lists training, prescribing authority, protocols, and physician oversight."
        },
        {
          "document_id": "DOC-WHO-CARD-0001",
          "block_index": 45,
          "relevance": 2,
          "rationale": "Implementation remarks describe supporting roles and collaborative-care conditions."
        }
      ],
      "notes": null
    },
    {
      "query_id": "MSV2-006",
      "query": "مريض ضغط وعنده مرض قلبي وعائي معروف أو خطورة قلبية وعائية مرتفعة، ما هدف ضغط الدم الانقباضي المقترح من منظمة الصحة العالمية؟",
      "language": "ar",
      "query_type": "cross_lingual",
      "difficulty": "medium",
      "expected_answerable": true,
      "target_concept": "WHO systolic blood pressure target for cardiovascular disease or high-risk hypertension",
      "expected_parent_section_number": "3.6",
      "evidence_scope": "single_source",
      "target_document_ids": [
        "DOC-WHO-CARD-0001"
      ],
      "preferred_document_id": null,
      "relevant_blocks": [
        {
          "document_id": "DOC-WHO-CARD-0001",
          "block_index": 37,
          "relevance": 3,
          "rationale": "WHO target-BP recommendation specifies systolic target below 130 mmHg for known CVD and suggests the same systolic target for high-risk patients."
        }
      ],
      "notes": null
    },
    {
      "query_id": "MSV2-007",
      "query": "According to the ACC/AHA classification summarized in the review, what office blood pressure range defines stage 1 hypertension?",
      "language": "en",
      "query_type": "direct_fact",
      "difficulty": "easy",
      "expected_answerable": true,
      "target_concept": "ACC/AHA stage 1 hypertension office blood pressure classification",
      "expected_parent_section_number": "DOC-PMC-CARD-0002-JATS-S003",
      "evidence_scope": "single_source",
      "target_document_ids": [
        "DOC-PMC-CARD-0002"
      ],
      "preferred_document_id": null,
      "relevant_blocks": [
        {
          "document_id": "DOC-PMC-CARD-0002",
          "block_index": 8,
          "relevance": 3,
          "rationale": "PMC Table 1 row directly lists ACC/AHA stage 1 hypertension as systolic 130–139 or diastolic 80–89 mmHg."
        }
      ],
      "notes": "PMC-only table retrieval case."
    },
    {
      "query_id": "MSV2-008",
      "query": "في قياس الضغط المنزلي، المريض يأخذ القراءات متى وكم قراءة في كل مرة، ويتم تقييم المتوسط كل كم أسبوع؟",
      "language": "ar",
      "query_type": "cross_lingual",
      "difficulty": "medium",
      "expected_answerable": true,
      "target_concept": "Home blood pressure monitoring measurement schedule",
      "expected_parent_section_number": "DOC-PMC-CARD-0002-JATS-S003",
      "evidence_scope": "single_source",
      "target_document_ids": [
        "DOC-PMC-CARD-0002"
      ],
      "preferred_document_id": null,
      "relevant_blocks": [
        {
          "document_id": "DOC-PMC-CARD-0002",
          "block_index": 18,
          "relevance": 3,
          "rationale": "PMC diagnostic-criteria paragraph specifies at least two readings one minute apart morning and evening and averaging every 2–4 weeks."
        }
      ],
      "notes": "Arabic semantic retrieval into an English PMC paragraph."
    },
    {
      "query_id": "MSV2-009",
      "query": "In the review's meta-analysis summary, approximately how much did the DASH diet reduce systolic and diastolic blood pressure?",
      "language": "en",
      "query_type": "direct_fact",
      "difficulty": "medium",
      "expected_answerable": true,
      "target_concept": "DASH diet blood pressure reduction magnitude",
      "expected_parent_section_number": "DOC-PMC-CARD-0002-JATS-S009",
      "evidence_scope": "single_source",
      "target_document_ids": [
        "DOC-PMC-CARD-0002"
      ],
      "preferred_document_id": null,
      "relevant_blocks": [
        {
          "document_id": "DOC-PMC-CARD-0002",
          "block_index": 45,
          "relevance": 3,
          "rationale": "PMC diet paragraph reports DASH reductions of about 7.6 mmHg systolic and 4.2 mmHg diastolic."
        }
      ],
      "notes": null
    },
    {
      "query_id": "MSV2-010",
      "query": "حسب المراجعة، ما الحد اليومي للصوديوم الذي توصي به الإرشادات الكندية والأوروبية لمرضى ارتفاع الضغط؟",
      "language": "ar",
      "query_type": "cross_lingual",